cluster_ID,files,title,description
0,ClusterMetrics.java; ContextFactory.java; CryptoUtils.java; CustomJobEndNotifier.java; FileSystemCounter.java; ID.java; InputFormat.java; InputSplit.java; JobACL.java; JobContext.java; JobCounter.java; JobID.java; JobStatus.java; JobSubmissionFiles.java; MRConfig.java; MRJobConfig.java; MapContext.java; MarkableIterator.java; MarkableIteratorInterface.java; OutputCommitter.java; OutputFormat.java; QueueAclsInfo.java; QueueInfo.java; RecordReader.java; RecordWriter.java; ReduceContext.java; SharedCacheConfig.java; StatusReporter.java; TaskAttemptContext.java; TaskCompletionEvent.java; TaskCounter.java; TaskInputOutputContext.java; TaskReport.java; TaskTrackerInfo.java; counters/AbstractCounters.java; counters/FileSystemCounterGroup.java; filecache/ClientDistributedCacheManager.java; jobhistory/AvroArrayUtils.java; jobhistory/JobSubmittedEvent.java; jobhistory/MapAttemptFinishedEvent.java; lib/aggregate/ValueAggregatorJob.java; lib/db/DBOutputFormat.java; lib/fieldsel/FieldSelectionHelper.java; lib/fieldsel/FieldSelectionMapper.java; lib/fieldsel/FieldSelectionReducer.java; lib/input/CombineFileInputFormat.java; lib/input/CombineFileRecordReader.java; lib/input/CombineFileRecordReaderWrapper.java; lib/input/CombineFileSplit.java; lib/input/CombineSequenceFileInputFormat.java; lib/input/CombineTextInputFormat.java; lib/input/CompressedSplitLineReader.java; lib/input/DelegatingInputFormat.java; lib/input/DelegatingMapper.java; lib/input/DelegatingRecordReader.java; lib/input/FileInputFormat.java; lib/input/FileSplit.java; lib/input/FixedLengthInputFormat.java; lib/input/FixedLengthRecordReader.java; lib/input/KeyValueLineRecordReader.java; lib/input/KeyValueTextInputFormat.java; lib/input/LineRecordReader.java; lib/input/MultipleInputs.java; lib/input/NLineInputFormat.java; lib/input/SequenceFileAsBinaryInputFormat.java; lib/input/SequenceFileAsTextInputFormat.java; lib/input/SequenceFileAsTextRecordReader.java; lib/input/SequenceFileInputFilter.java; lib/input/SequenceFileInputFormat.java; lib/input/SequenceFileRecordReader.java; lib/input/SplitLineReader.java; lib/input/TaggedInputSplit.java; lib/input/TextInputFormat.java; lib/input/UncompressedSplitLineReader.java; lib/jobcontrol/ControlledJob.java; lib/jobcontrol/JobControl.java; lib/join/ArrayListBackedIterator.java; lib/join/ComposableInputFormat.java; lib/join/ComposableRecordReader.java; lib/join/CompositeInputFormat.java; lib/join/CompositeInputSplit.java; lib/join/CompositeRecordReader.java; lib/join/InnerJoinRecordReader.java; lib/join/JoinRecordReader.java; lib/join/MultiFilterRecordReader.java; lib/join/OuterJoinRecordReader.java; lib/join/OverrideRecordReader.java; lib/join/Parser.java; lib/join/ResetableIterator.java; lib/join/StreamBackedIterator.java; lib/join/TupleWritable.java; lib/join/WrappedRecordReader.java; lib/map/InverseMapper.java; lib/map/TokenCounterMapper.java; lib/output/BindingPathOutputCommitter.java; lib/output/FileOutputCommitter.java; lib/output/FileOutputFormat.java; lib/output/FilterOutputFormat.java; lib/output/LazyOutputFormat.java; lib/output/MapFileOutputFormat.java; lib/output/MultipleOutputs.java; lib/output/NullOutputFormat.java; lib/output/PartialFileOutputCommitter.java; lib/output/PartialOutputCommitter.java; lib/output/SequenceFileAsBinaryOutputFormat.java; lib/output/SequenceFileOutputFormat.java; lib/output/TextOutputFormat.java; lib/partition/InputSampler.java; lib/partition/TotalOrderPartitioner.java; lib/reduce/IntSumReducer.java; lib/reduce/LongSumReducer.java; protocol/ClientProtocol.java; protocol/ClientProtocolProvider.java; security/IntermediateEncryptedStream.java; security/SecureShuffleUtils.java; security/SpillCallBackInjector.java; security/SpillCallBackPathsFinder.java; security/TokenCache.java; security/token/JobTokenIdentifier.java; security/token/JobTokenSecretManager.java; security/token/JobTokenSelector.java; server/jobtracker/JTConfig.java; server/tasktracker/TTConfig.java; split/JobSplit.java; split/JobSplitWriter.java; split/SplitMetaInfoReader.java; task/MapContextImpl.java; task/TaskAttemptContextImpl.java; task/TaskInputOutputContextImpl.java; task/annotation/Checkpointable.java; task/reduce/EventFetcher.java; task/reduce/ExceptionReporter.java; task/reduce/Fetcher.java; task/reduce/IFileWrappedMapOutput.java; task/reduce/InMemoryMapOutput.java; task/reduce/InMemoryReader.java; task/reduce/InMemoryWriter.java; task/reduce/LocalFetcher.java; task/reduce/MapHost.java; task/reduce/MapOutput.java; task/reduce/MergeManager.java; task/reduce/MergeThread.java; task/reduce/Shuffle.java; task/reduce/ShuffleClientMetrics.java; task/reduce/ShuffleHeader.java; task/reduce/ShuffleScheduler.java; task/reduce/ShuffleSchedulerImpl.java; util/ConfigUtil.java; util/HostUtil.java; util/MRJobConfUtil.java; util/ProcessTree.java; v2/LogParams.java,Hadoop MapReduce Cluster Architecture,"The Hadoop MapReduce cluster architecture comprises Java-based components that ensure seamless job execution and management. The `ClusterMetrics.java` class tracks cluster performance, while `ContextFactory.java` creates MapReduce Context Objects, facilitating interaction between tasks. `CryptoUtils.java` ensures data security via encryption, and `CustomJobEndNotifier.java` allows for tailored job completion notifications.

`MRJobConfig.java` and `MapContext.java` configure and provide context to the Mapper, respectively. `MarkableIterator.java` and `MarkableIteratorInterface.java` support data navigation, while `OutputCommitter.java` and `OutputFormat.java` manage task output commit and specifications. `QueueAclsInfo.java` and `QueueInfo.java` handle job queue ACLs and information, and `RecordReader.java` defines the abstract RecordReader class for input data reading.

This architecture demonstrates high scalability, maintainability, and reliability, leveraging Java as the primary technology. It employs patterns such as factory (ContextFactory.java) and observer (CustomJobEndNotifier.java) to ensure efficient job execution and management in the MapReduce framework."
1,Partitioner.java; lib/partition/BinaryPartitioner.java; lib/partition/HashPartitioner.java; lib/partition/KeyFieldBasedComparator.java; lib/partition/KeyFieldBasedPartitioner.java; lib/partition/KeyFieldHelper.java; lib/partition/RehashPartitioner.java; security/token/delegation/DelegationTokenIdentifier.java; security/token/delegation/DelegationTokenSecretManager.java; security/token/delegation/DelegationTokenSelector.java,Hadoop MapReduce Partitioning and Security,"This Hadoop MapReduce architecture employs a partitioning mechanism for efficient data distribution and a secure job execution model. The Partitioner.java class, an abstract base, uses hash functions to partition keys, with custom partitioners like BinaryPartitioner, HashPartitioner, and KeyFieldBasedPartitioner in the 'lib/partition' directory, demonstrating the Strategy pattern for varied partitioning strategies. The 'security/token/delegation' directory manages MapReduce tokens for secure job submission and tracking, implementing the Delegate pattern for secure access and job management. This design ensures scalability, maintainability, and reliability, leveraging Java and Hadoop's framework. It supports performance through efficient data distribution and security through token-based access control."
2,checkpoint/CheckpointID.java; checkpoint/CheckpointNamingService.java; checkpoint/CheckpointService.java; checkpoint/EnumCounter.java; checkpoint/FSCheckpointID.java; checkpoint/FSCheckpointService.java; checkpoint/RandomNameCNS.java; checkpoint/SimpleNamingService.java; checkpoint/TaskCheckpointID.java; util/ResourceBundles.java,Hadoop MapReduce Cluster Architecture,"This Hadoop MapReduce cluster architecture comprises two main components: Task Checkpoint Management and ResourceBundle Management. The Task Checkpoint Management, facilitated by the CheckpointID, CheckpointNamingService, CheckpointService, EnumCounter, FSCheckpointID, FSCheckpointService, RandomNameCNS, SimpleNamingService, and TaskCheckpointID, ensures fault tolerance and job recovery through reliable checkpoint management. The ResourceBundle Management, handled by the ResourceBundles.java class, efficiently retrieves resources from bundles, ensuring thread safety and exception handling. The architecture leverages Java for implementation, demonstrating scalability, maintainability, and reliability. The coordinator pattern is evident in the Task Checkpoint Management, while the utility pattern is observed in the ResourceBundle Management."
3,Counter.java; CounterGroup.java; Counters.java; JobPriority.java; QueueState.java; counters/AbstractCounter.java; counters/AbstractCounterGroup.java; counters/CounterGroupBase.java; counters/CounterGroupFactory.java; counters/FrameworkCounterGroup.java; counters/GenericCounter.java; counters/LimitExceededException.java; counters/Limits.java; counters/package-info.java; filecache/package-info.java; jobhistory/package-info.java; lib/aggregate/DoubleValueSum.java; lib/aggregate/LongValueMax.java; lib/aggregate/LongValueMin.java; lib/aggregate/LongValueSum.java; lib/aggregate/StringValueMax.java; lib/aggregate/StringValueMin.java; lib/aggregate/UniqValueCount.java; lib/aggregate/UserDefinedValueAggregatorDescriptor.java; lib/aggregate/ValueAggregator.java; lib/aggregate/ValueAggregatorBaseDescriptor.java; lib/aggregate/ValueAggregatorCombiner.java; lib/aggregate/ValueAggregatorDescriptor.java; lib/aggregate/ValueAggregatorJobBase.java; lib/aggregate/ValueAggregatorMapper.java; lib/aggregate/ValueAggregatorReducer.java; lib/aggregate/ValueHistogram.java; lib/db/DBConfiguration.java; lib/db/DBInputFormat.java; lib/db/DBRecordReader.java; lib/db/DBWritable.java; lib/db/DataDrivenDBInputFormat.java; lib/db/DataDrivenDBRecordReader.java; lib/db/MySQLDBRecordReader.java; lib/db/MySQLDataDrivenDBRecordReader.java; lib/db/OracleDBRecordReader.java; lib/db/OracleDataDrivenDBRecordReader.java; lib/input/FileInputFormatCounter.java; lib/input/InvalidInputException.java; lib/map/RegexMapper.java; lib/output/FileOutputFormatCounter.java; protocol/package-info.java; security/package-info.java; security/token/delegation/package-info.java; security/token/package-info.java; split/package-info.java; task/package-info.java; task/reduce/package-info.java; util/CountersStrings.java; util/package-info.java,Hadoop MapReduce Cluster Architecture,"The Hadoop MapReduce cluster architecture comprises interconnected components for job management, data processing, and security. The 'counters' directory implements the Abstract Factory pattern for diverse counter groups, ensuring modularity and extensibility. 'filecache' organizes file caching operations, adhering to maintainable design principles. 'jobhistory' uses a layered pattern for job history storage and retrieval. 'lib' encapsulates reusable Java libraries, employing patterns like Adapter, Strategy, Observer, and Composite. 'protocol' provides package documentation, aiding developers. 'security' ensures shuffle and spill encryption, using metadata documentation. 'split' prepares for split operations. 'task/reduce' organizes Reduce phase classes, following modular design. 'util' provides utility classes, adhering to the Utility pattern. This architecture ensures scalability, maintainability, reliability, and security, leveraging Hadoop's core classes, Google's Guava library, and standard Java libraries."
4,lib/output/FileOutputCommitterFactory.java; lib/output/NamedCommitterFactory.java; lib/output/PathOutputCommitter.java; lib/output/PathOutputCommitterFactory.java; lib/output/committer/manifest/ManifestCommitter.java; lib/output/committer/manifest/ManifestCommitterConfig.java; lib/output/committer/manifest/ManifestCommitterConstants.java; lib/output/committer/manifest/ManifestCommitterFactory.java; lib/output/committer/manifest/ManifestCommitterStatisticNames.java; lib/output/committer/manifest/files/AbstractManifestData.java; lib/output/committer/manifest/files/DiagnosticKeys.java; lib/output/committer/manifest/files/DirEntry.java; lib/output/committer/manifest/files/EntryStatus.java; lib/output/committer/manifest/files/FileEntry.java; lib/output/committer/manifest/files/ManifestPrinter.java; lib/output/committer/manifest/files/ManifestSuccessData.java; lib/output/committer/manifest/files/TaskManifest.java; lib/output/committer/manifest/files/package-info.java; lib/output/committer/manifest/impl/AuditingIntegration.java; lib/output/committer/manifest/impl/EntryFileIO.java; lib/output/committer/manifest/impl/InternalConstants.java; lib/output/committer/manifest/impl/LoadedManifestData.java; lib/output/committer/manifest/impl/ManifestCommitterSupport.java; lib/output/committer/manifest/impl/ManifestStoreOperations.java; lib/output/committer/manifest/impl/ManifestStoreOperationsThroughFileSystem.java; lib/output/committer/manifest/impl/OutputValidationException.java; lib/output/committer/manifest/impl/package-info.java; lib/output/committer/manifest/package-info.java; lib/output/committer/manifest/stages/AbortTaskStage.java; lib/output/committer/manifest/stages/AbstractJobOrTaskStage.java; lib/output/committer/manifest/stages/CleanupJobStage.java; lib/output/committer/manifest/stages/CommitJobStage.java; lib/output/committer/manifest/stages/CommitTaskStage.java; lib/output/committer/manifest/stages/CreateOutputDirectoriesStage.java; lib/output/committer/manifest/stages/JobOrTaskStage.java; lib/output/committer/manifest/stages/LoadManifestsStage.java; lib/output/committer/manifest/stages/RenameFilesStage.java; lib/output/committer/manifest/stages/SaveSuccessFileStage.java; lib/output/committer/manifest/stages/SaveTaskManifestStage.java; lib/output/committer/manifest/stages/SetupJobStage.java; lib/output/committer/manifest/stages/SetupTaskStage.java; lib/output/committer/manifest/stages/StageConfig.java; lib/output/committer/manifest/stages/StageEventCallbacks.java; lib/output/committer/manifest/stages/TaskAttemptScanDirectoryStage.java; lib/output/committer/manifest/stages/ValidateRenamedFilesStage.java; lib/output/committer/manifest/stages/package-info.java,Hadoop MapReduce Output Committer,"The Hadoop MapReduce Output Committer ensures data integrity during MapReduce tasks' output. It comprises auditing classes, SequenceFile management, constants, and file system operation utilities. The committer maintains reliability and consistency in Hadoop's distributed file system, employing helper and abstract base classes for modularity. It interacts with Hadoop classes for seamless integration, ensuring dependable task output committal. This architecture prioritizes reliability and data consistency, leveraging Java for implementation within the Hadoop framework. The committer pattern ensures that all data is durably stored, enhancing overall system dependability."
5,TaskAttemptID.java; TaskID.java; TaskType.java; jobhistory/AMStartedEvent.java; jobhistory/EventReader.java; jobhistory/EventWriter.java; jobhistory/HistoryEvent.java; jobhistory/HistoryEventHandler.java; jobhistory/HistoryViewer.java; jobhistory/HistoryViewerPrinter.java; jobhistory/HumanReadableHistoryViewerPrinter.java; jobhistory/JSONHistoryViewerPrinter.java; jobhistory/JobFinishedEvent.java; jobhistory/JobHistoryParser.java; jobhistory/JobInfoChangeEvent.java; jobhistory/JobInitedEvent.java; jobhistory/JobPriorityChangeEvent.java; jobhistory/JobQueueChangeEvent.java; jobhistory/JobStatusChangedEvent.java; jobhistory/JobUnsuccessfulCompletionEvent.java; jobhistory/NormalizedResourceEvent.java; jobhistory/ReduceAttemptFinishedEvent.java; jobhistory/TaskAttemptFinishedEvent.java; jobhistory/TaskAttemptStartedEvent.java; jobhistory/TaskAttemptUnsuccessfulCompletionEvent.java; jobhistory/TaskFailedEvent.java; jobhistory/TaskFinishedEvent.java; jobhistory/TaskStartedEvent.java; jobhistory/TaskUpdatedEvent.java; util/JobHistoryEventUtils.java,Task Identification and Logging in Hadoop MapReduce,"Hadoop MapReduce employs a robust task identification system, utilizing 'TaskAttemptID.java' and 'TaskID.java' classes for unique task tracking within jobs. 'TaskAttemptID' combines 'TaskID' and an attempt number, ensuring each task attempt's uniqueness. 'TaskID' identifies Map or Reduce tasks, encapsulating job ID, task type, and task number. Both classes ensure immutability and provide methods for comparison, serialization, and deserialization. 'TaskType.java' defines task types, including MAP, REDUCE, JOB_SETUP, JOB_CLEANUP, and TASK_CLEANUP. This system, built with Java, ensures scalability, maintainability, and reliability by enabling efficient task tracking and management in Hadoop MapReduce jobs."
6,lib/db/BigDecimalSplitter.java; lib/db/BooleanSplitter.java; lib/db/DBSplitter.java; lib/db/DateSplitter.java; lib/db/FloatSplitter.java; lib/db/IntegerSplitter.java; lib/db/OracleDataDrivenDBInputFormat.java; lib/db/OracleDateSplitter.java; lib/db/TextSplitter.java,Hadoop MapReduce Cluster Architecture,"The Hadoop MapReduce cluster architecture, comprising six nodes, employs a master-slave model. The master node, or JobTracker, coordinates tasks and assigns them to slave nodes, or TaskTrackers. Input data is split into InputSplits by database splitter classes in the 'lib/db' directory, facilitating parallel processing. MapReduce jobs are executed in two phases: Map and Reduce. The Map phase processes data in parallel across TaskTrackers, while the Reduce phase collects, sorts, and aggregates the Map outputs. This architecture ensures scalability, maintainability, and reliability, leveraging Java and Hadoop technologies. The Data-Driven pattern is evident in the database splitter classes, optimizing Hadoop's efficiency. Security is maintained through Hadoop's access control mechanisms. Performance is enhanced by data locality optimization, where tasks are scheduled near the data they process."
7,Cluster.java; Job.java; JobResourceUploader.java; JobSubmitter.java; Mapper.java; Reducer.java; filecache/DistributedCache.java; lib/chain/Chain.java; lib/chain/ChainMapContextImpl.java; lib/chain/ChainMapper.java; lib/chain/ChainReduceContextImpl.java; lib/chain/ChainReducer.java; lib/map/MultithreadedMapper.java; lib/map/WrappedMapper.java; lib/reduce/WrappedReducer.java; task/JobContextImpl.java; task/ReduceContextImpl.java; task/reduce/MergeManagerImpl.java; task/reduce/OnDiskMapOutput.java; tools/CLI.java,Hadoop MapReduce Cluster Architecture,"This cluster architecture leverages Hadoop MapReduce for distributed processing. The DistributedCache.java manages file caching, ensuring accessibility across nodes. Specialized libraries in the 'lib' directory extend core functionalities, employing patterns like Chain, Decorator, and Thread Pool. OnDiskMapOutput.java handles temporary map output storage, supporting encryption and deletion. The CLI.java provides a command-line interface for job management, utilizing a command pattern. This architecture ensures scalability, maintainability, and reliability through distributed caching, specialized libraries, and robust output management. It employs Java, Hadoop core classes, and standard libraries, demonstrating a coordinator-worker pattern with a focus on performance and security."
