cluster_ID,files,title,description
0,ClusterMetrics.java; ContextFactory.java; CryptoUtils.java; CustomJobEndNotifier.java; FileSystemCounter.java; ID.java; InputFormat.java; InputSplit.java; JobACL.java; JobContext.java; JobCounter.java; JobID.java; JobStatus.java; JobSubmissionFiles.java; MRConfig.java; MRJobConfig.java; MapContext.java; MarkableIterator.java; MarkableIteratorInterface.java; OutputCommitter.java; OutputFormat.java; QueueAclsInfo.java; QueueInfo.java; RecordReader.java; RecordWriter.java; ReduceContext.java; SharedCacheConfig.java; StatusReporter.java; TaskAttemptContext.java; TaskCompletionEvent.java; TaskCounter.java; TaskInputOutputContext.java; TaskReport.java; TaskTrackerInfo.java; counters/AbstractCounters.java; counters/FileSystemCounterGroup.java; filecache/ClientDistributedCacheManager.java; jobhistory/AvroArrayUtils.java; jobhistory/JobSubmittedEvent.java; jobhistory/MapAttemptFinishedEvent.java; lib/aggregate/ValueAggregatorJob.java; lib/db/DBOutputFormat.java; lib/fieldsel/FieldSelectionHelper.java; lib/fieldsel/FieldSelectionMapper.java; lib/fieldsel/FieldSelectionReducer.java; lib/input/CombineFileInputFormat.java; lib/input/CombineFileRecordReader.java; lib/input/CombineFileRecordReaderWrapper.java; lib/input/CombineFileSplit.java; lib/input/CombineSequenceFileInputFormat.java; lib/input/CombineTextInputFormat.java; lib/input/CompressedSplitLineReader.java; lib/input/DelegatingInputFormat.java; lib/input/DelegatingMapper.java; lib/input/DelegatingRecordReader.java; lib/input/FileInputFormat.java; lib/input/FileSplit.java; lib/input/FixedLengthInputFormat.java; lib/input/FixedLengthRecordReader.java; lib/input/KeyValueLineRecordReader.java; lib/input/KeyValueTextInputFormat.java; lib/input/LineRecordReader.java; lib/input/MultipleInputs.java; lib/input/NLineInputFormat.java; lib/input/SequenceFileAsBinaryInputFormat.java; lib/input/SequenceFileAsTextInputFormat.java; lib/input/SequenceFileAsTextRecordReader.java; lib/input/SequenceFileInputFilter.java; lib/input/SequenceFileInputFormat.java; lib/input/SequenceFileRecordReader.java; lib/input/SplitLineReader.java; lib/input/TaggedInputSplit.java; lib/input/TextInputFormat.java; lib/input/UncompressedSplitLineReader.java; lib/jobcontrol/ControlledJob.java; lib/jobcontrol/JobControl.java; lib/join/ArrayListBackedIterator.java; lib/join/ComposableInputFormat.java; lib/join/ComposableRecordReader.java; lib/join/CompositeInputFormat.java; lib/join/CompositeInputSplit.java; lib/join/CompositeRecordReader.java; lib/join/InnerJoinRecordReader.java; lib/join/JoinRecordReader.java; lib/join/MultiFilterRecordReader.java; lib/join/OuterJoinRecordReader.java; lib/join/OverrideRecordReader.java; lib/join/Parser.java; lib/join/ResetableIterator.java; lib/join/StreamBackedIterator.java; lib/join/TupleWritable.java; lib/join/WrappedRecordReader.java; lib/map/InverseMapper.java; lib/map/TokenCounterMapper.java; lib/output/BindingPathOutputCommitter.java; lib/output/FileOutputCommitter.java; lib/output/FileOutputFormat.java; lib/output/FilterOutputFormat.java; lib/output/LazyOutputFormat.java; lib/output/MapFileOutputFormat.java; lib/output/MultipleOutputs.java; lib/output/NullOutputFormat.java; lib/output/PartialFileOutputCommitter.java; lib/output/PartialOutputCommitter.java; lib/output/SequenceFileAsBinaryOutputFormat.java; lib/output/SequenceFileOutputFormat.java; lib/output/TextOutputFormat.java; lib/partition/InputSampler.java; lib/partition/TotalOrderPartitioner.java; lib/reduce/IntSumReducer.java; lib/reduce/LongSumReducer.java; protocol/ClientProtocol.java; protocol/ClientProtocolProvider.java; security/IntermediateEncryptedStream.java; security/SecureShuffleUtils.java; security/SpillCallBackInjector.java; security/SpillCallBackPathsFinder.java; security/TokenCache.java; security/token/JobTokenIdentifier.java; security/token/JobTokenSecretManager.java; security/token/JobTokenSelector.java; server/jobtracker/JTConfig.java; server/tasktracker/TTConfig.java; split/JobSplit.java; split/JobSplitWriter.java; split/SplitMetaInfoReader.java; task/MapContextImpl.java; task/TaskAttemptContextImpl.java; task/TaskInputOutputContextImpl.java; task/annotation/Checkpointable.java; task/reduce/EventFetcher.java; task/reduce/ExceptionReporter.java; task/reduce/Fetcher.java; task/reduce/IFileWrappedMapOutput.java; task/reduce/InMemoryMapOutput.java; task/reduce/InMemoryReader.java; task/reduce/InMemoryWriter.java; task/reduce/LocalFetcher.java; task/reduce/MapHost.java; task/reduce/MapOutput.java; task/reduce/MergeManager.java; task/reduce/MergeThread.java; task/reduce/Shuffle.java; task/reduce/ShuffleClientMetrics.java; task/reduce/ShuffleHeader.java; task/reduce/ShuffleScheduler.java; task/reduce/ShuffleSchedulerImpl.java; util/ConfigUtil.java; util/HostUtil.java; util/MRJobConfUtil.java; util/ProcessTree.java; v2/LogParams.java,MapReduce,"The MapReduce framework is a distributed processing paradigm used for processing large data sets. It consists of two main components: the Map component and the Reduce component. The Map component is responsible for processing input data and transforming it into a format that can be easily processed by the Reduce component. The Reduce component is responsible for performing the final processing and generating the desired output. The MapReduce framework follows the architectural pattern of the MapReduce framework, which is a distributed processing paradigm used for processing large data sets. The MapReduce framework consists of two main components:"
1,Partitioner.java; lib/partition/BinaryPartitioner.java; lib/partition/HashPartitioner.java; lib/partition/KeyFieldBasedComparator.java; lib/partition/KeyFieldBasedPartitioner.java; lib/partition/KeyFieldHelper.java; lib/partition/RehashPartitioner.java; security/token/delegation/DelegationTokenIdentifier.java; security/token/delegation/DelegationTokenSecretManager.java; security/token/delegation/DelegationTokenSelector.java,MapReduce Delegation Token Architecture,"The MapReduce delegation token architecture is responsible for managing and generating delegation tokens specific to MapReduce. The DelegationTokenIdentifier class extends the AbstractDelegationTokenIdentifier class and provides functionality for creating and managing these tokens. The DelegationTokenSecretManager class is responsible for creating a MapReduce specific delegation token secret manager, which is used to generate and accept the password for each token. The DelegationTokenSelector class extends the AbstractDelegationTokenSelector class and specializes it for MapReduce. This architecture ensures secure and efficient management of delegation tokens within the MapReduce framework."
2,checkpoint/CheckpointID.java; checkpoint/CheckpointNamingService.java; checkpoint/CheckpointService.java; checkpoint/EnumCounter.java; checkpoint/FSCheckpointID.java; checkpoint/FSCheckpointService.java; checkpoint/RandomNameCNS.java; checkpoint/SimpleNamingService.java; checkpoint/TaskCheckpointID.java; util/ResourceBundles.java,Cluster 2,"The cluster consists of two main components: a Utility class and a Worker class.
The Utility class provides common utility methods for various purposes, while the Worker class collaborates with the Utility class to perform tasks.
The architecture follows the Utility class pattern, which is a creational pattern that provides a central place for creating and storing utility objects.
The Utility class pattern is used to achieve scalability, maintainability, and reusability of utility methods.
The technologies used in this architecture include Java, Maven, and Git."
3,Counter.java; CounterGroup.java; Counters.java; JobPriority.java; QueueState.java; counters/AbstractCounter.java; counters/AbstractCounterGroup.java; counters/CounterGroupBase.java; counters/CounterGroupFactory.java; counters/FrameworkCounterGroup.java; counters/GenericCounter.java; counters/LimitExceededException.java; counters/Limits.java; counters/package-info.java; filecache/package-info.java; jobhistory/package-info.java; lib/aggregate/DoubleValueSum.java; lib/aggregate/LongValueMax.java; lib/aggregate/LongValueMin.java; lib/aggregate/LongValueSum.java; lib/aggregate/StringValueMax.java; lib/aggregate/StringValueMin.java; lib/aggregate/UniqValueCount.java; lib/aggregate/UserDefinedValueAggregatorDescriptor.java; lib/aggregate/ValueAggregator.java; lib/aggregate/ValueAggregatorBaseDescriptor.java; lib/aggregate/ValueAggregatorCombiner.java; lib/aggregate/ValueAggregatorDescriptor.java; lib/aggregate/ValueAggregatorJobBase.java; lib/aggregate/ValueAggregatorMapper.java; lib/aggregate/ValueAggregatorReducer.java; lib/aggregate/ValueHistogram.java; lib/db/DBConfiguration.java; lib/db/DBInputFormat.java; lib/db/DBRecordReader.java; lib/db/DBWritable.java; lib/db/DataDrivenDBInputFormat.java; lib/db/DataDrivenDBRecordReader.java; lib/db/MySQLDBRecordReader.java; lib/db/MySQLDataDrivenDBRecordReader.java; lib/db/OracleDBRecordReader.java; lib/db/OracleDataDrivenDBRecordReader.java; lib/input/FileInputFormatCounter.java; lib/input/InvalidInputException.java; lib/map/RegexMapper.java; lib/output/FileOutputFormatCounter.java; protocol/package-info.java; security/package-info.java; security/token/delegation/package-info.java; security/token/package-info.java; split/package-info.java; task/package-info.java; task/reduce/package-info.java; util/CountersStrings.java; util/package-info.java,Hadoop MapReduce Security Package,"The Hadoop MapReduce Security package provides classes for authentication and authorization in the Hadoop MapReduce framework. The core logic is contained in the UserGroupInformation class, which offers methods for authentication and authorization. The package also includes classes for authentication using tokens, such as the TokenSelector and Tokenizer classes. These classes depend on the classes in the org.apache.hadoop.mapreduce.security.token package. The package ensures scalability, maintainability, reliability, security, and performance."
4,lib/output/FileOutputCommitterFactory.java; lib/output/NamedCommitterFactory.java; lib/output/PathOutputCommitter.java; lib/output/PathOutputCommitterFactory.java; lib/output/committer/manifest/ManifestCommitter.java; lib/output/committer/manifest/ManifestCommitterConfig.java; lib/output/committer/manifest/ManifestCommitterConstants.java; lib/output/committer/manifest/ManifestCommitterFactory.java; lib/output/committer/manifest/ManifestCommitterStatisticNames.java; lib/output/committer/manifest/files/AbstractManifestData.java; lib/output/committer/manifest/files/DiagnosticKeys.java; lib/output/committer/manifest/files/DirEntry.java; lib/output/committer/manifest/files/EntryStatus.java; lib/output/committer/manifest/files/FileEntry.java; lib/output/committer/manifest/files/ManifestPrinter.java; lib/output/committer/manifest/files/ManifestSuccessData.java; lib/output/committer/manifest/files/TaskManifest.java; lib/output/committer/manifest/files/package-info.java; lib/output/committer/manifest/impl/AuditingIntegration.java; lib/output/committer/manifest/impl/EntryFileIO.java; lib/output/committer/manifest/impl/InternalConstants.java; lib/output/committer/manifest/impl/LoadedManifestData.java; lib/output/committer/manifest/impl/ManifestCommitterSupport.java; lib/output/committer/manifest/impl/ManifestStoreOperations.java; lib/output/committer/manifest/impl/ManifestStoreOperationsThroughFileSystem.java; lib/output/committer/manifest/impl/OutputValidationException.java; lib/output/committer/manifest/impl/package-info.java; lib/output/committer/manifest/package-info.java; lib/output/committer/manifest/stages/AbortTaskStage.java; lib/output/committer/manifest/stages/AbstractJobOrTaskStage.java; lib/output/committer/manifest/stages/CleanupJobStage.java; lib/output/committer/manifest/stages/CommitJobStage.java; lib/output/committer/manifest/stages/CommitTaskStage.java; lib/output/committer/manifest/stages/CreateOutputDirectoriesStage.java; lib/output/committer/manifest/stages/JobOrTaskStage.java; lib/output/committer/manifest/stages/LoadManifestsStage.java; lib/output/committer/manifest/stages/RenameFilesStage.java; lib/output/committer/manifest/stages/SaveSuccessFileStage.java; lib/output/committer/manifest/stages/SaveTaskManifestStage.java; lib/output/committer/manifest/stages/SetupJobStage.java; lib/output/committer/manifest/stages/SetupTaskStage.java; lib/output/committer/manifest/stages/StageConfig.java; lib/output/committer/manifest/stages/StageEventCallbacks.java; lib/output/committer/manifest/stages/TaskAttemptScanDirectoryStage.java; lib/output/committer/manifest/stages/ValidateRenamedFilesStage.java; lib/output/committer/manifest/stages/package-info.java,Hadoop MapReduce Architecture,"Hadoop MapReduce is a distributed processing framework that enables large-scale data processing tasks. It consists of two main components: the Map phase and the Reduce phase. The Map phase breaks down the input data into smaller chunks and processes them in parallel, while the Reduce phase aggregates the results from the Map phase and produces the final output. The MapReduce architecture is designed to scale horizontally, meaning that it can handle large volumes of data by adding more nodes to the cluster. It also provides fault tolerance, meaning that if a node fails, the system can automatically recover and continue processing the data. Additionally, Hadoop MapReduce supports a wide range of data formats, including text, sequence files, and Avro, and provides a rich set of APIs for developers to build custom processing logic."
5,TaskAttemptID.java; TaskID.java; TaskType.java; jobhistory/AMStartedEvent.java; jobhistory/EventReader.java; jobhistory/EventWriter.java; jobhistory/HistoryEvent.java; jobhistory/HistoryEventHandler.java; jobhistory/HistoryViewer.java; jobhistory/HistoryViewerPrinter.java; jobhistory/HumanReadableHistoryViewerPrinter.java; jobhistory/JSONHistoryViewerPrinter.java; jobhistory/JobFinishedEvent.java; jobhistory/JobHistoryParser.java; jobhistory/JobInfoChangeEvent.java; jobhistory/JobInitedEvent.java; jobhistory/JobPriorityChangeEvent.java; jobhistory/JobQueueChangeEvent.java; jobhistory/JobStatusChangedEvent.java; jobhistory/JobUnsuccessfulCompletionEvent.java; jobhistory/NormalizedResourceEvent.java; jobhistory/ReduceAttemptFinishedEvent.java; jobhistory/TaskAttemptFinishedEvent.java; jobhistory/TaskAttemptStartedEvent.java; jobhistory/TaskAttemptUnsuccessfulCompletionEvent.java; jobhistory/TaskFailedEvent.java; jobhistory/TaskFinishedEvent.java; jobhistory/TaskStartedEvent.java; jobhistory/TaskUpdatedEvent.java; util/JobHistoryEventUtils.java,Hadoop MapReduce Architecture Abstraction,"The Hadoop MapReduce architecture consists of the JobTracker, TaskTrackers, and the Hadoop Distributed File System (HDFS). The JobTracker is responsible for scheduling and monitoring MapReduce jobs, while the TaskTrackers execute the tasks assigned by the JobTracker. HDFS is used for distributed storage and retrieval of data. The MapReduce framework follows a master-slave architecture, with the JobTracker acting as the master and the TaskTrackers acting as slaves. The communication between the components is facilitated by the Hadoop RPC mechanism. The MapReduce framework is designed to handle large-scale data processing tasks efficiently and scalably."
6,lib/db/BigDecimalSplitter.java; lib/db/BooleanSplitter.java; lib/db/DBSplitter.java; lib/db/DateSplitter.java; lib/db/FloatSplitter.java; lib/db/IntegerSplitter.java; lib/db/OracleDataDrivenDBInputFormat.java; lib/db/OracleDateSplitter.java; lib/db/TextSplitter.java,DBSplitter,"The DBSplitter interface is implemented by classes in this directory to handle various data types. These classes collaborate with the DataDrivenDBInputFormat class to read input data from a database table and generate input splits for processing. The architecture ensures scalability, maintainability, and reliability by separating concerns and using appropriate technologies."
7,Cluster.java; Job.java; JobResourceUploader.java; JobSubmitter.java; Mapper.java; Reducer.java; filecache/DistributedCache.java; lib/chain/Chain.java; lib/chain/ChainMapContextImpl.java; lib/chain/ChainMapper.java; lib/chain/ChainReduceContextImpl.java; lib/chain/ChainReducer.java; lib/map/MultithreadedMapper.java; lib/map/WrappedMapper.java; lib/reduce/WrappedReducer.java; task/JobContextImpl.java; task/ReduceContextImpl.java; task/reduce/MergeManagerImpl.java; task/reduce/OnDiskMapOutput.java; tools/CLI.java,MapReduce - Merge Manager,"The Merge Manager is a crucial component of the Hadoop MapReduce framework, responsible for managing the merging of map outputs during the shuffle and sort phase of a MapReduce job. It contains logic for merging in-memory map outputs, as well as logic for merging on-disk map outputs. The Merge Manager takes inputs in the form of map outputs, which can be either in-memory or on-disk, and produces outputs in the form of merged map outputs, which are written to disk. The Merge Manager depends on various classes and interfaces from the Apache Hadoop MapReduce framework, including MapOutputFile, RawKeyValueIterator, Reducer, CombineOutputCollector, Counters.Counter, CompressionCodec, and Progress."
